{
  "analyses": [
    {
      "audit_ids": [
        "aud.ps007.v001.a.0005"
      ],
      "citations": [],
      "created_at": "2026-09-27T18:53:20.374745+00:00",
      "created_by": "codex-analysis",
      "created_via": "codex",
      "epistemics": {
        "known_from_text": [
          {
            "basis": "Verses 2–3 address Yahweh, name pursuers, and compare the threatened attack to a lion tearing its victim.",
            "claim": "The speaker presents himself as pursued and seeks rescue."
          },
          {
            "basis": "The repeated conditions in verses 4–5 lead to the consequences permitted in verse 6.",
            "claim": "The speaker makes a conditional oath rather than admitting guilt."
          },
          {
            "basis": "Verses 8–10 name assembled peoples, judgment, the wicked, the righteous, and testing hearts and kidneys.",
            "claim": "The judgment appeal extends beyond the speaker to peoples and moral categories."
          },
          {
            "basis": "Hands and dust occur in verses 4–6; hearts and kidneys in verse 10; shield and weapons in verses 11–14; childbirth, pit, and head in verses 15–17.",
            "claim": "The setting preserves bodily and material images alongside its modern diction."
          },
          {
            "basis": "Verse 5 assigns causelessness to the foe's hostility; verse 9 renders righteousness as 'the right I've done'; verse 12 adds burning to the expression of indignation.",
            "claim": "The setting makes several interpretive choices explicit."
          },
          {
            "basis": "The pit's digger falls into it in verse 16, and his trouble and violence return onto his head in verse 17.",
            "claim": "The final sequence portrays wrongdoing recoiling upon its maker."
          },
          {
            "basis": "Verse 18 uses paired first-person declarations of thanksgiving and singing, without narrating a completed rescue.",
            "claim": "The ending expresses a commitment to praise."
          }
        ],
        "not_known_from_text": [
          {
            "claim": "David's historical authorship or a securely identified event involving Cush.",
            "why_not": "The heading supplies a received attribution and brief occasion, without independent corroboration or an identifiable narrative."
          },
          {
            "claim": "The exact charge, identities of the pursuers, or historical truth of the speaker's innocence.",
            "why_not": "The poem offers the speaker's conditional self-defense and appeals, without an external account or detailed accusation."
          },
          {
            "claim": "A uniquely settled interpretation of verse 5 or the pronouns in verses 13–14.",
            "why_not": "Verse 5 permits disputed lexical and syntactic readings; verses 13–14 leave subjects and pronoun referents unnamed."
          },
          {
            "claim": "A specific historical ritual, venue, instrumentation, or vocal arrangement.",
            "why_not": "Singing, Selah, and the judicial assembly do not specify those performance circumstances."
          },
          {
            "claim": "An ancient 6/8 meter or a verified musical realization of this English setting.",
            "why_not": "The 6/8 target comes from translator guidance; no score or performance is supplied."
          },
          {
            "claim": "The speaker has already received the requested deliverance.",
            "why_not": "The final thanksgiving commitment provides no narrative confirmation that the threat has ended."
          }
        ]
      },
      "generation_run_id": "cxr.01a0cd1e32d1",
      "generator_provider": "codex-app-server",
      "guardrails": {
        "cultic_setting": "The heading's singing to Yahweh and the closing resolve to sing praise support a religious song or prayer setting. Selah is a received structural or performance-related marker whose exact function is uncertain. The assembly of peoples and divine judgment provide a public judicial scene within the poem; they do not establish an actual congregation, temple ceremony, festival, sacrifice, priestly role, or particular performance venue.",
        "heading_attribution": "The heading associates the Shiggayon with David, presents him as its singer to Yahweh, and connects it with the words or matter of Cush, a Benjaminite. The lyric's possessive preserves that association, while its passive 'sung' leaves the singer implicit. The heading does not independently establish historical authorship, identify Cush beyond this designation, or establish a specific biographical episode. Shiggayon's precise significance remains uncertain."
      },
      "method": "Compared the complete English setting with the supplied Masoretic text, ordered token evidence, and the literal backbones examined in the preceding verse audits. Tracked speaker, addressee, conditions, imagery, repeated vocabulary, and the explicit Selah. Section titles are analytical descriptions because no arrangement labels were supplied. No external edition, lexicon, or commentary was consulted.",
      "non_source_material": [
        {
          "kind": "meter",
          "note": "Translator guidance supplied earlier in the task, not wording or meter established by the Hebrew. It does not appear as sung text.",
          "text": "target 6/8 meter"
        }
      ],
      "prompt_template_version": "codex-analysis-v1",
      "psalm_analysis_id": "anl.ps007.0001",
      "psalm_id": "ps007",
      "revision_of": null,
      "sections": [
        {
          "arc_note": "Introduces the song's received attribution and occasion before the first-person prayer.",
          "first_verse": 1,
          "last_verse": 1,
          "theme": "Davidic association and the matter of Cush.",
          "title": "Heading"
        },
        {
          "arc_note": "The shelter declaration turns immediately into the feared lion attack; the dash links the appeal to its threatened consequence.",
          "first_verse": 2,
          "last_verse": 3,
          "theme": "An appeal for rescue from a lethal pursuer.",
          "title": "Shelter and pursuit"
        },
        {
          "arc_note": "Repeated if clauses culminate in permission for pursuit, capture, trampling, and humiliation. The disputed rescue clause interrupts the conditions as a counterclaim. Selah closes the stretch.",
          "first_verse": 4,
          "last_verse": 6,
          "theme": "The speaker submits himself to consequences if guilty.",
          "title": "Conditional oath"
        },
        {
          "arc_note": "Rising and awakening answer the preceding downward imagery. The scene widens to assembled peoples, then returns to the speaker's integrity and the testing of inward life.",
          "first_verse": 7,
          "last_verse": 10,
          "theme": "Divine intervention and judgment among the peoples.",
          "title": "Rise and judge"
        },
        {
          "arc_note": "The shield declaration becomes a warning through daily anger, sword, bow, and burning arrows. Verse 13 retains a potentially confusing shift between unnamed subjects.",
          "first_verse": 11,
          "last_verse": 14,
          "theme": "Protection of the upright and readiness for judgment.",
          "title": "Shield, judge, and weapons"
        },
        {
          "arc_note": "Childbirth gives way to excavation and a fall; the trouble conceived in verse 15 returns onto the head in verse 17.",
          "first_verse": 15,
          "last_verse": 17,
          "theme": "Evil produces deception and recoils upon its maker.",
          "title": "Wrongdoing returns"
        },
        {
          "arc_note": "The first-person voice returns with paired commitments to thanks and song, ending on Most High.",
          "first_verse": 18,
          "last_verse": 18,
          "theme": "Thanksgiving grounded in Yahweh's righteousness.",
          "title": "Commitment to praise"
        }
      ],
      "source_fingerprint": "63a873ed6ce0145c281b159373a3f7e4bbec65d4e9fdaffc24587b6ea95b3c0d",
      "status": "proposed",
      "structural_seams": [
        {
          "after_verse": 6,
          "aligns_with_section": true,
          "marker": "Selah"
        }
      ],
      "summary": "The setting moves from urgent shelter-seeking through a conditional oath of innocence to an appeal for public judgment. Confidence in God's protection leads into weapon imagery, then images of wrongdoing returning upon its maker, and finally a commitment to thanksgiving. Short phrases and contractions modernize the voice while retaining the lion, hands, dust, hearts and kidneys, shield, weapons, childbirth, pit, and head imagery. Interpretive choices include the rescue reading in verse 5, righteousness expressed as conduct in verse 9, and an added heat metaphor in verse 12. The closing praise does not report that rescue has already occurred.",
      "translation_id": "tr.ps007.0001"
    }
  ],
  "arrangements": [
    {
      "arrangement_id": "arr.ps007.0001",
      "audit_ids": [
        "aud.ps007.v001.a.0006"
      ],
      "created_at": "2026-09-27T19:24:17.801023+00:00",
      "created_by": "codex",
      "created_via": "codex",
      "generation_run_id": "cxr.5362d0a35743",
      "guidance": "target 6/8 meter",
      "layer": "lyric",
      "omissions": [],
      "prompt_template_version": "codex-arrangement-v1",
      "psalm_id": "ps007",
      "sections": [
        {
          "kind": "intro",
          "label": "Intro — 6/8 throughout; two-bar phrases with held endings",
          "lines": [
            {
              "anchors": [
                {
                  "token_ids": [
                    "ps007.v001.t001",
                    "ps007.v001.t002"
                  ],
                  "unit_id": "ps007.v001.a"
                }
              ],